{
  "schema_id": "asset-mania/approval-receipt",
  "schema_version": "1.0",
  "receipt_id": "receipt-face-rights-1",
  "plan_sha256": "3bd34dbe24c70e14c55b6eff81642b6ce329800e4ba94204baf9ae0389535122",
  "gate": "face_rights",
  "issued_at": "2026-08-19T09:35:00Z",
  "expires_at": "2026-08-19T10:35:00Z",
  "scope": "single_run",
  "disclosure_digest": "d3d3d3d3d3d3d3d3d3d3d3d3d3d3d3d3d3d3d3d3d3d3d3d3d3d3d3d3d3d3d3d3",
  "issuer_type": "user",
  "acknowledgement_digest": "d2d2d2d2d2d2d2d2d2d2d2d2d2d2d2d2d2d2d2d2d2d2d2d2d2d2d2d2d2d2d2d2",
  "receipt_sha256": "c86aaa2bf6c490d1c7933636f60f3532e827307ad211f0844d8729005d27799d"
}
