{
  "schema_id": "asset-mania/approval-receipt",
  "schema_version": "1.0",
  "receipt_id": "receipt-paid-compute-1",
  "plan_sha256": "3bd34dbe24c70e14c55b6eff81642b6ce329800e4ba94204baf9ae0389535122",
  "gate": "paid_compute",
  "issued_at": "2026-08-19T09:35:00Z",
  "expires_at": "2026-08-19T10:35:00Z",
  "scope": "single_run",
  "disclosure_digest": "d3d3d3d3d3d3d3d3d3d3d3d3d3d3d3d3d3d3d3d3d3d3d3d3d3d3d3d3d3d3d3d3",
  "issuer_type": "user",
  "acknowledgement_digest": "d2d2d2d2d2d2d2d2d2d2d2d2d2d2d2d2d2d2d2d2d2d2d2d2d2d2d2d2d2d2d2d2",
  "receipt_sha256": "68e7b5764bf78b4a35a0cc9ea0eb0ad55b091b9f2d294c72a4d9975fe303b406"
}
